convoid,person,dialogue
27,Prospect,"Yeah, it's probably about that. Not all of them will be commissioned, but it's probably about that."
27,SDR,"Okay. Okay. Is there any kind of. So currently, where do you store all your deal related data? Do you have a centralized CRM in place?"
27,Prospect,Uuh.. Yes.
27,SDR,Which one would that be? It'll just help me prepare for the demo. A little better… you know I can make it more relevant to you.
27,Prospect,So it's our own ERP system.
27,SDR,Okay. You have an internal ERP system?
27,Prospect,Yeah.
27,SDR,"All right. So we'll have to figure out the integration bit because what we usually do is we. So there's two kinds of data that we need to fetch to automate commissions. One is the deal related data, and one is if you have some kind of an invoicing or accounting tool. Basically because some companies tend to incentivize their salespeople on invoices collected or when the invoices realize or the payment comes in. Some companies also do it on booking meetings. Right. So we usually integrate with both the systems. Do you have any accounting tool in place where all invoice related data is stored? Currently?"
27,Prospect,Yes.
27,SDR,And which one would that be?
27,Prospect,It would be the same ERP system.
27,SDR,"Or the same ERP system. All right. Okay. So we'll have to. We'll have to maybe during our call, sort of discuss as to how, you know, we're going to go about integrating this. Do you have any APIs for this ERP system?"
27,Prospect,Yes.
27,SDR,"Okay, perfect. That should solve the problem. I think I've got all the information I need. It was great talking to you. Have a great week. We'll connect next week on the call. I'll send an email shortly."
27,Prospect,Cheers. Bye.
28,Prospect,Hi
28,SDR,"Hey, this is Ashley calling with second nature. I'm going to be honest with you, this is a cold call. Can I have 30 seconds of your time or would you like to hang up?"
28,Prospect,"Well, my inclination is to hang up, but you got 30 seconds."
28,SDR,"Okay, I'll be quick. So I typically get invited by sales enablement teams that are frustrated that they don't have enough personal time for new hires during the onboarding process or they don't know where to focus the little time coaching that they do have to make the most impact or they can't measure the impact of their training programs. If you could change any of these, what would it be? Is that a good one?"
28,Prospect,"So it was, it was good because it started out with a good open question. So I teach, I run our global value selling program. So good introduction, really like the technique. Now let's dispense with this. Umm.. What does your product do?"
28,SDR,"Okay, so for training we can provide scalability. We've certified 1500 sellers in 30 minutes and there's no other solution that can do that. And Jenny is an immersive simulation so your sales reps can practice with her on the fly even if it's ten minutes a day. So it's like muscle memory. They get to practice and practice and practice. They're scored and they can do it on their own time. They're scored and the information…."
28,Prospect,"Okay. Okay. Timeout, timeout, timeout, timeout."
28,SDR,Yes.
28,Prospect,This is an application platform in the cloud.
28,SDR,"Oops, I'm sorry."
28,Prospect,"So this is an application runs in the cloud, correct?"
28,SDR,"I am. Honestly. That's a great question. I don't believe that it runs. She is an AI, so she learns as you go. And what we do is either you can create your own simulations or we could have our team of experts. What they do is actually you let them know your training process and your company messaging and they build her that way so she'll actually ask you questions."
28,Prospect,Are you a platform? Are you a service? Are you an application?
28,SDR,"Yes, we're SaaS. Yes, yes. So it's in the cloud."
28,Prospect,"Yeah. Okay. Okay, so you're SaaS. Okay. Do you connect into a content learning management system or are you a platform."
28,SDR,"Okay, okay. What we do. Oops, I'm sorry. Go ahead."
28,Prospect,"Okay. So as the customer, you want to keep me talking. So a couple things here. A couple things. Okay. So this provides e-learning modules or this provides simulations? And these are built either by your customers or by your team."
28,SDR,"That's correct. And we can integrate. If you do have a current LMS system, that's not a problem. So we compliment that because we put the end user in the actual situation. So basically, the way to look at it. So imagine the sellers ingest all the learning content in your LMS system and then uses second nature as a way to do the practical training. It's like the LMS is like school. Second nature is like the field trip, interactive, and it's a replica situation."
28,Prospect,"Okay, so you're all about simulations? Yes?"
28,SDR,"Yes, yes. And we can also do webcam recordings as well. If there's any new messaging that needs to be rolled out. One of our clients actually used us at their SKO, and so everybody was aligned on all the company messaging. You can run it as a gamification as well."
28,Prospect,How big is your company right now?
28,SDR,"We have about 200. 200 employees, and we do work with large companies as well. Zoom, Twilio, checkpoint."
28,Prospect,"Sorry, you totally broke up. I was. I was driving over a bridge. So who are the companies that you work with? You work with Checkpoint. Who else?"
28,SDR,"Checkpoint, Zoominfo, Twilio, SAP, Lookout, and that's just to name a few."
28,Prospect,Okay. And those are all enterprise customers or they're just playing with your product for free?
28,SDR,"Oh, no, those are all enterprise customers. Or actually, Zoom has Jenny, what we call our AI, on their org chart. So they're actually the ones that trained over 1600 reps on their new Zoom story, which was competitive position."
28,Prospect,How are you used with Twilio?
28,SDR,"So Twilio that's one of our largest companies. They're the ones that use this for their SKO, and they set up a training. Within 72 hours, we had 1300 sales reps certified. And their challenge was getting sellers trained for selling individual products to a suite. And they also knew positioning around their acquisition."
28,Prospect,"Okay, so here's the deal. This is what I'd like you to send me. You piqued my interest."
28,SDR,"Well, thank you."
28,Prospect,"So Rhea is the head of enablement over at our company. I know her really well. I worked with her for a number of years over at our company. So this is what you can send to my corporate email. Let me give that to you. It's my first name at company dot com, okay. Want to know the companies you're working with, want to know the specifics around Twilio and want links that shows either a YouTube or a video, how your stuff works. I promise I'll check it out. Because one of the things that I'm always focused on is muscle memory around the value selling methodology and building simulations. Doing a ton of that work right now. And if your product can help. I'd be certainly, you know, I'd want to run that kind of up the black hole in my organization because I think it's an area that we struggle with. I am a minute away from Microsoft headquarters. I'm going to be working with them on some CRM solutions."
28,SDR,We're actually speaking with them as well.
28,Prospect,"Awesome. So if you go ahead and send that to me, I will definitely check it out. Please feel free to follow up with me if you don't hear from me within a week. I definitely have interest in something like that. It just kind of depends on how it's all being used and deployments and all that good stuff. How does that sound?"
28,SDR,"That sounds really well, actually. I am not the account executive. That's Michael. So I'm going to run all of this by him as well. And that way I make sure I get you all the information."
28,Prospect,Do me a big favor. Don't make Michael call me again.
28,SDR,I won't let Michael call you.
28,Prospect,"Have him send me the information that I requested, and I will take a look at it. And we'll just get right to the heart of the matter whether or not we can use it. And I would be willing to entertain a call with Michael after I respond to the email letting you know what I think from my perspective."
28,SDR,"Okay, that sounds good to me. I have all this noted, and I will get with him and we'll get that right over to you."
28,Prospect,"All right. Hey, great intro, by the way. I love that \"
28,SDR,"Well, that came from myself. So I'm going to pat myself on the back for that one."
28,Prospect,"I love it. I love it. It's very fair and it empowers your caller, believe me. You got too many SDRs. Just kind of jumping into spiel. That was great. All right, I do have to run. Thank you. I look forward to that email. I definitely will check it out because I am interested in this area."
28,SDR,"Okay, that sounds great. I'll get this over. And thank you so much for all that feedback as well. You just made my day."
28,Prospect,"Awesome, awesome. Keep at it. You know what the next rule is?"
28,SDR,What's that?
28,Prospect,Got to strike. You got to strike while the iron is hot. So you just had a successful call. Go make another one.
28,SDR,I'm keeping it going.
28,Prospect,Have a wonderful day.
28,SDR,All right. Thank you. Bye.
29,SDR,"Hi, this is Dom calling from Cognism. How's your day going?"
29,Prospect,Pretty good. What's going on?
29,SDR,"It's good to hear. Yeah, I know. I'm probably catching you out of the blue this morning. Just wondering if you had 20 seconds I could tell you why I was reaching out."
29,Prospect,Sure.
29,SDR,"Awesome. Yeah, so the reason why I was giving you a call is because here at Cognism, we work with a lot of sales and business development leaders like yourself to provide you guys with validated mobile contact data for your prospects. As you know, a lot more people have been working from home these days. So business development leaders have actually noticed a drop-off in connections and gaps in mobile coverage. I was just calling to see what kind of process you and your team had in place for when you don't have, like, the full contact data for your most important leads."
29,Prospect,"I'm not one that would be in charge of that, but I can maybe at least direct someone to you. Well, hold on a second. Let me get pen and paper here. Wasn't at my computer."
29,SDR,"No, no worries."
29,Prospect,What's a good contact for you? I can maybe put somebody in touch with you here.
29,SDR,"Well, I mean, generally, you know, I'd like to talk to somebody who's closer to the user end side of the situation. You know, I noticed on LinkedIn you were business development manager, so I assumed you'd be using, you know, these tools in your day-to-day basis. By any chance? You know, are you using any zoom info or Lusha in your day-to-day operations?"
29,Prospect,"We use. Are you talking about, like, Zoom meetings? So, like, we use Microsoft Teams? Is that. If that's what you're referring to?"
29,SDR,"Oh, no, I'm actually talking about, like, a data provider, like a sales intelligence tool."
29,Prospect,"Oh, yeah. We use what? We use Sherpa for our CRM and then we resell Konica printing equipment. So we deal with Konica, who has phone systems and everything like that that we use."
29,SDR,Okay. So you're already probably getting your contact data for leads and stuff through them?
29,Prospect,Yes.
29,SDR,"Okay. And by any chance, you know, when. When you don't have, let's say, a valid phone number for one of your contacts or leads that came in? What's typically the route you go through to try to extract that information?"
29,Prospect,"We've got.. uh.. We've got a couple different things, but we rely on our CRM system a lot for that. And then our sales people that are out in the field putting the right information into the system."
29,SDR,"Got it. Okay. Yeah. And by any chance those people on the sale? I'm sorry, those people on the field, are those just regular reps or they, you know, VPs or sales directors?"
29,Prospect,"Really, all of the above. I mean, we've got our, you know, up-and-down-the-street reps and then our major account reps and then the management team that would be all out in the field with those guys."
29,SDR,"Okay, yeah, that makes sense. But by any chance, are you having a team that has lead generation abilities that are actively sourcing the correct and accurate mobile numbers and direct dials and emails for all your contacts?"
29,Prospect,"I don't know what we use, but in terms of getting the correct contacts, we've got a system that pulls up our lease information and competitive lease information and then basically gives us that account. I don't know that it necessarily gives us the contact info, though."
29,SDR,"Yeah, so, I mean, Cognism, just to give a little background, and I'm being pretty vague right now, but Cognism pretty much is just like one of those platforms, except we do help with the account by giving you the list of accounts, but we also give you the titles and industries that you would want to be pinpointing. And let's just say, you know, you want a John Smith that, you know, and you don't have their mobile number or their direct. We actually go out and human verify that on demand for you within 48 hours. That's pretty much what we do here at Cognism, is we just equip sales teams with more accurate mobile phone data as well as emails and directs because those have been, you know, valuable in the past. By any chance, you know, would you be interested in getting a free data sample from us and then you can kind of compare your coverage with ours?"
29,Prospect,"Umm.. Yeah, that, I mean that.. uh.. you can send that to me directly and I can get with our team and see on the back end because I don't, I don't handle that part of it. But, uuhm… yeah, I can get with our team and say, hey, does this make any sense to check into? I'm happy to do that."
29,SDR,"Yeah. By any chance, would you have like 15 minutes we can throw on the calendar for this week and we can meet with one of our data specialists? They're the ones that take care of the whole data extraction on the platform and they'll have more of, like in detail conversation with you about the titles. You're trying to pinpoint the industries, what kind of verticals are working, that type of stuff."
29,Prospect,"Yeah, that's fine. I can, I can do a 15-minute call sometime this week."
29,SDR,All right. Would tomorrow work for you?
29,Prospect,Tomorrow is not going to be good. I'm pretty busy tomorrow.
29,SDR,All right. Are you in eastern time by any chance?
29,Prospect,Yes.
29,SDR,"Okay, so let's see here. Would, would 11:00 a.m. on Wednesday be all right for you?"
29,Prospect,"Yeah, give me a second. I'm jumping into my calendar."
29,SDR,No worries. Take your time.
29,Prospect,"Wednesday at eleven? Yeah, that's fine. Yep."
29,SDR,"Awesome. Yeah, I'll put you in for Wednesday at eleven and we'll have a more enriched discussion then. But is there any other information that you want me to jot down the notes just so we can make sure we use the best use of your time?"
29,Prospect,"No, I don't think I have anything specific. Do you have my email address?"
29,SDR,Then the one I have on file right now is first name at company dot com.
29,Prospect,"Yep, that's it."
29,SDR,Awesome. Great. Yep. I'll send you that email next few minutes here for the confirmation and I look forward to talking.
29,Prospect,Cool. Sounds good.
29,SDR,Appreciate it. All right. Have a good one. Bye.
30,SDR,"Hey Wade, it's Steve Richard from ExecVision. How's it going?"
30,Prospect,"Hey, I'm good, and yourself?"
30,SDR,"Yeah, I'm doing well. Hey, I'm on a recorded line is that all right?"
30,Prospect,Uh.. you're recording this right now?
30,SDR,That's right.
30,Prospect,"Uh.. yeah, sure. I have no issue with that."
30,SDR,"I appreciate that. So my understanding is you're a commercial sales manager, right? And you're overseeing the commercial team in that segment?"
30,Prospect,"That is correct, yes."
30,SDR,"Okay, very good, and uh.. how many.. how many reps you're totally overseeing in your organization?"
30,Prospect,How many.. say that again… you broke up in there.
30,SDR,How many reps uh in your organization in total?
30,Prospect,"uh.. that varies. uh.. good days, it's around 12. It just depends on who's in the office, who's out in the field."
30,SDR,"Oh I hear you.. yeah.. You're in Houston, right? I hope everything's going to get a little bit more back to normal there."
30,Prospect,"Oh, everything's been back to normal, yes."
30,SDR,"Very good.. very good. Well, hey, the reason I'm calling is, umm, you know, a lot of folks that I'm working with right now are kind of in this new world, as everything that's shaken up in sales. They're trying to turn to their call recordings for the purposes of driving consistency in their team.. uh.. are you doing any recording of either calls or maybe online meetings, your zooms, your teams, those kinds of things?"
30,Prospect,"uh.. Yes, I record every single one of my zoom meetings and save them in files. My team is set up to do that through Microsoft Teams and at the same time we do have the capabilities to record our own calls."
30,SDR,"Phenomenal okay very good so you're very bought into this, you're trying to drive consistency, get people doing their calls in a similar way, right?"
30,Prospect,Correct.
30,SDR,"Very good. So one of the challenges I mean in terms of kind of crawl, walk, running, it sounds like you're walking very well, one of the things that people say is they're looking for the opportunity to take that to the next level to really bring forward much more sophisticated call libraries and then also take advantage of uh transcription – \"
30,Prospect,"Uh, you're.. you're kind of cutting in and out unfortunately, you said could I be able to do a call for what?"
30,SDR,"To see how some of your peers are using this kind of what's called conversation intelligence at other companies. I can walk you through what folks are doing and how you could take your game to, you know, really a good place to even the next level."
30,Prospect,"Umm.. I honestly think we're okay for right now. We're currently looking at alternate CRM systems that'll hopefully enhance uh some of the people that within our team to get things out faster, talk to customers a little more consistently and training and everything but yeah for right now we're just trying to implement that system and I think we're okay for right now."
30,SDR,What uh.. what CRM are you on today?
30,Prospect,"Uh we just utilize an internal system we use Sage, we have Microsoft Teams, we have a couple of different systems umm.. but looking at other ones that we're going to be utilizing for project management for customer service or customer relations management uhm.. you know a couple of different systems that we're evaluating."
30,SDR,"Interesting so funny enough uh.. Sage Intact, I mean they're really more of like a financial system but Sage Intact is one of our customers. So they use, they use ExecVision all the time and just I think I kind of misspoke before we're not a CRM but rather it's transcription and it's the ability to use call recordings for training and coaching to help the reps get better because you know I heard what you said about using your recordings of Microsoft Teams meetings but the challenge with that is like nobody has an hour to sit there and listen minute for a minute uh.. this is all about how do you pinpoint just the focus area and look I totally get that you're not in a buying mode right now, if you're open to leaving commerce off the table, I think if you saw this and were introduced to this topic, to this idea, I think it would you know, it'd probably help you a ton as you're looking forward for your team."
30,Prospect,"uh.. absolutely, I understand. It's just that yeah right now we're not necessarily in that in that mode. We're just we're incredibly busy right now, will tell you that to where it'd even be put on kind of the back burner but uh for that matter it's something that we're not actually, you know turned off from entirely, it's just right now it's not that the time for us by any means."
30,SDR,"Yeah just a bit a bit too busy at the time? I.. I get it. uuhm so let me.. let me ask you this, you know uh obviously like you're sales rep, so I wouldn't be doing a good job if I didn't try again and didn't try for that third time and look we can keep it brief we can keep it to a 20 minute and really serve as a resource for you uh for example we have a really good guide to how to create a call coaching culture and some time saving methods when using recording, so you know I would.. I would just set expectations we'd be doing this with you Wade and give you a lot of value for that time and then after that certainly if nothing came of it for many months that's okay. So what what.. what would you say we give a shot for that?"
30,Prospect,"I tell you what, if you've got kind of a cut sheet or some documentation or handouts that you'd like to send over, I can take a look at them. uhm feel free to do that, allow me to review and kind of see what you'll offer and then I can make a decision from there if that works for you."
30,SDR,That works for me. What's the email?
30,Prospect,"Yes, W-arnold. w-a-r-n-o-l-d at quick serve, q-u-i-k-s-e-r-v dot com."
30,SDR,"Got it. And last question for you, when you think about your current process, you record all those Microsoft Teams calls um what's.. what's been the.. you know if you had a magic wand, then you could.. you could have something where you got a lot more value from those calls. What would that look like? The only reason I ask is that way I can send the right content for you."
30,Prospect,uh.. so what would be the right call? Is that what you're asking?
30,SDR,"So I'm saying, if you had a magic wand and you could.. you could change one thing about how you're using those Microsoft Teams call recordings, what would that one thing be; to make it easier for you, to make it more effective, what would you do?"
30,Prospect,"Uh just the i guess the compatibility of being able to condense that file and send it to people that uh.. you know.. i send a lot of this information and people need to be able to evaluate it and look at it and read it and so if that content could be collapsed versus trying to send a larger file, a larger recording. That would certainly be helpful."
30,SDR,"Interesting. Okay, so Wade, are you.. when you record at Microsoft Teams meeting are you then sharing that with your customer and your prospect, who can share it with other decision makers?"
30,Prospect,"uh.. in some sense, yes. I will send it to people who request it, I'll send it to some of our trainees also people across the country that need to review it and look at it uh but yeah for the most part it's nice that they're sending it to their customers, I just provide it for anyone that asks."
30,SDR,"Okay that is a yeah.. that's something.. that's sending a snippet. I can.. I'd be happy to share.. I'll even share a snippet of our call so you can see what that looks like? with the video of the teams. And hey last question for you umm.. across Quickserve, so outside of commercial sales, how many total uh customer facing reps are there? So if you look at the entire business outside of your segment."
30,Prospect,"uh.. we've got a few out there on the field right now, probably anywhere between half a dozen to upwards to, you know two dozen. It all just depends on who's hiring, some of our distribution partners out there, some of our agency reps, uh people of that nature. So yeah it ranges anywhere between half a dozen to maybe up to two dozen or so."
30,SDR,Okay. Okay and then do you guys have a call center as well?
30,Prospect,uh.. you're you're basically speaking to it. This is our call center here in Houston.
30,SDR,"Oh, interesting! Okay, so because I knew you're a commercial sales manager and when you started talking about Microsoft Teams, I was getting the impression that your team's dealing with some of the mid-size commercial accounts as opposed to being more of like, uh, you know, like a call center taking inbound calls and doing outbound calls like that."
30,Prospect,We do. We have our own team here internally that supports a lot of different customer bases out there.
30,SDR,"Got it. Okay, because you've got your partners and your distribution channel, so you're.. you're supporting them there as well."
30,Prospect,"Correct, yes."
30,SDR,"All right, very good. Hey, last question because I know you mentioned you use Teams and you're thinking about switching the CRM, but that hasn't happened anytime soon, umm.. do you have a call center management platform that you use, like Five9, RingCentral, that kind of thing?"
30,Prospect,"uh.. I honestly could not tell you what our internal system are.. uh I'm not that familiar with it or who runs, better operates that. So I couldn't even tell you that, honestly."
30,SDR,"Okay, and what I meant by that is, like, your team that's taking phone calls, when they take inbound phone calls. What is that phone system that they're using for taking the inbound calls?"
30,Prospect,"uh.. we just have Comcast, for that matter; I guess that's all I can really kind of reveal or tell you.. I.. uh, really don't know."
