convoid,person,dialogue
14,Prospect,"No, it's just predicting the burn rate on our projects."
14,SDR,"Got it. And I'm just trying to guess, what do you think is the KPI or metric that's suffering as a result of this inaccurate forecasting?"
14,Prospect,Ummm… Probablyy.. you know.. just hitting our targets or at least letting our..ahh executives know when we're going to miss our targets. That's the important part.
14,SDR,"Yeah. I'm guessing you folks want to be profitable as a PS org, right? And, hey, you know, just a shot in the dark. You're probably using a PSA tool today, right?"
14,Prospect,"Yes, we are."
14,SDR,Do you think the PSA tool is giving you as much insight into the forecasting bit and the project management bit as it should be?
14,Prospect,"They do a pretty good job, but there's always things that can improve."
14,SDR,Got it. And what would those things be?
14,Prospect,Being able to separate the forecast from the actuals.
14,SDR,"That sounds really interesting. That sounds to me like it's a pretty, you know, it's table stakes in terms of requirements. Do you feel it's in the way you folks have set it up, or do you feel that the tool just doesn't have the capability to show you that?"
14,Prospect,I guess just the way that the tool is designed.
14,SDR,"Got it. And it's probably FinancialForce and Mavenlink or something like that. Hey, you've been very kind in answering all these questions I've thrown at you. Can I tell you what Rocket Lane does real quick without making it a yawn-worthy sales pitch?"
14,Prospect,Sure.
14,SDR,"I appreciate it. So we're basically reinventing the wheel when it comes to customer-facing PSA because we're the only tool in the world that lets you tie together your PSA stuff and your project management stuff all happening out of one tool. So think forecasting, resources, resource management, time sheeting, financials, project burn rates, trying to see if you're profitable as a PS org. All that is tied into your project management itself. And the entire thing is customer-facing from the ground up. So you choose to see what you want customers to see and you hold them accountable during delivery as well. So typically we see PS teams using something like FinancialForce or Mavenlink and trying to make that work together with a Smartsheet. So whenever they have changes in project requirements, they're not able to make that change in their resource plans. And there's a lot of manual work and redundancies going on in the process. We tie that entire experience into one, and I guess the metrics that we'd impact would be better forecasting and making sure PS teams are pulling revenue forward so they can stay profitable. Does any of this resonate with you at all?"
14,Prospect,"It does, yeah. Yeah. The customer-facing portion."
14,SDR,Yeah. So would you be open to spending 20 minutes with me to try and understand how we solve for this and just chat a little bit more about your priorities and see if there's any way we can help out?
14,Prospect,"Yeah, sure. I'd be open to that."
14,SDR,That sounds good. Does tomorrow work for you? Same time tomorrow?
14,Prospect,"Well, actually you caught me at a bad time. I'm getting married, so I'm going to be off tomorrow through July 12, so I'll be back."
14,SDR,"Congratulations. First of all, I think it's a great time. I don't think it's a bad time. You're probably looking forward to that break."
14,Prospect,"Yes, for sure."
14,SDR,"So you said July 12, right? I'm guessing your first week back in is going to be crazy. Yeah, shoot for the afternoon of the 17th, which is the Monday after."
14,Prospect,"Sure. Yeah, we can do that. I got 03:00 p.m. open."
14,SDR,"03:00 p.m. Eastern, right."
14,Prospect,Sorry. 03:00 p.m. Eastern.
14,SDR,"Yeah. 03:00 p.m. Eastern. Sweet. My name is Ani. I'll just shoot you a note on LinkedIn so you can put a face to my name. Hey, congrats on the wedding, man!"
14,Prospect,Thank you.
14,SDR,Awesome. I'll be in touch. Appreciate it.
14,Prospect,All right. Have a good one.
14,SDR,Yeah. See you.
14,Prospect,Bye.
15,SDR,"Hi, this is Sophia calling from Simera."
15,Prospect,"Hi, how are you?"
15,SDR,"I'm good, thank you. How are you?"
15,Prospect,Good. Where are you calling from? Again? I'm sorry.
15,SDR,I'm calling from Simera. I sent you some emails a couple of weeks ago regarding the openings you guys have. The remote opening.
15,Prospect,Which company?
15,SDR,Simera.
15,Prospect,Yeah.. what's.. What's the question?
15,SDR,"So. Well, I'm calling because I wanted to know if you guys are interested in hiring in Latin America."
15,Prospect,Hiring what?
15,SDR,Hiring people in Latin America.
15,Prospect,"Oh, in Latin America. Sorry, which posting are you speaking of?"
15,SDR,"Well, it's specifically for a product manager because I found your page that you were looking for a product manager. But actually, we could, I mean, if we talk and see what your needs are, we can surely look for someone in some other job opening if you guys have."
15,Prospect,"Yeah, so we need.. ummm.. like auhm.. a program manager. But how would that work? I mean, are you saying you would just lease someone for the duration of what we needed? Or do you find full time?"
15,SDR,"Yeah. It works.. Basically, what we do is we have a quick talk, the account executive and our co-founder, for example, with you, and you tell them all the details. What do you need? And the specific job posting that you are looking for. And we send you, like, a couple of resumes so you can see if you like them or not. And, I mean, we do that until you find the perfect fit for your role. But those details, you can talk them over with our co-founder. So maybe we could schedule a 15 minutes meeting if you're interested."
15,Prospect,"Yeah, but how does the compensation go? You find someone and then you're out of the middle. Or are you in the middle the whole time?"
15,SDR,"No, we're in the middle the whole time. I mean, we do everything for you. The payroll, all that. Payroll. The payroll process. The hiring process. I mean, it's really quick, it's cost-effective. It's like from 40% to 60% more cost-effective than hiring without Simera. So I think it would be a good fit for you guys. So we could schedule the meeting if you're interested."
15,Prospect,"No, I know. I just want to make sure we're still trying to build our product. And I appreciate you reaching out. It's just like, for one role, I wish we had a little bit more to do this with because we do have staff augmentation, people coming and going, but I just don't believe in that business model."
15,SDR,"I mean, maybe you could talk to our co-founder and see if you find, like, a fit for that. I mean, he could tell you all the details, like. And I mean, with no compromise at all. I mean, just that 15 minutes meeting and that's it?"
15,Prospect,"Yeah, I can. I can do that. That's fine. Where you.. Where are you located?"
15,SDR,In Boston.
15,Prospect,"Okay, and where's he located?"
15,SDR,What?
15,Prospect,Where's he located?
15,SDR,"In Boston, too."
15,Prospect,In Boston. Okay.
15,SDR,Yeah.
15,Prospect,Yeah.
15,SDR,"So maybe I can.. Yeah, I mean, your email is josh.com, right?"
15,Prospect,Correct.
15,SDR,What time would be good for you? Maybe tomorrow or today.
15,Prospect,Umm.. I could probably do something this afternoon. Today. Tomorrow is pretty bad.
15,SDR,"Okay, so I'll send you one today at four. Would that be good? Or two?"
15,Prospect,I can do five.
15,SDR,"All right, you're located.. What's your time?"
15,Prospect,Umm.. East coast.
15,SDR,"East coast. All right, so I'll send you the email right now with the meeting at five."
15,Prospect,"Okay, that's for the calendar invite, correct?"
15,SDR,Yeah.
15,Prospect,"Okay, cool. And.. Sorry. Your name again?"
15,SDR,Sophia. My name is Sophia.
15,Prospect,Sophia. Got it.
15,SDR,Thank you so much. Have a good day.
15,Prospect,Bye bye.
15,SDR,See you later.
15,Prospect,Bye.
16,SDR,"Hello, am I speaking with Justin?"
16,Prospect,"Yes, speaking."
16,SDR,"My name is Nathan, I'm calling from Hivelocity company. Did I perhaps catch you at a good time?"
16,Prospect,"uhm… Actually I'm about to go to a meeting right now, but what is this call about?"
16,SDR,"Okay, it wouldn't take more than 30 seconds. Yeah, I saw you're a CTO and as I mentioned, Hivelocity. We are a bare metal cloud provider offering different edge compute solutions. We are running a very large bare metal cloud platform with 40 plus sites, compute locations providing hosting, colocation, and bare metal services to thousands of businesses. Just more than anything else, I was interested to know and get more insights on your cloud computing infrastructure efforts. And if I can share some information via email that highlights our value points."
16,Prospect,"Yeah sure, we're just using AWS. Yes. So if you could just send me some information about your infrastructure, I will look into that definitely."
16,SDR,"Okay, great. Actually, I mean using some of the other providers, we definitely expect that as we speak every day with businesses who are using any of the major public clouds. And as I said, just wanted to introduce you to what we're doing, showing you how we're moving or adding to bare metal and how we provide cost reduction, performance improvement, customer reach with our 40 plus edge compute locations. So yeah, I can share that email with you right after this call. Would you probably be open to hearing more about us from our management team on a brief call? Probably anytime you would have next week? Or the week after?"
16,Prospect,Sure.
16,SDR,Okay. Are you in front of your calendar right now or would you like me to propose a time?
16,Prospect,uh.. If you could do this next week on.. uh… next week on Wednesday 11:00 a.m. pacific time.
16,SDR,"11:00 a.m. pacific time. Okay, that works great. I will send that invitation to you. I have here your email. Is that your best email?"
16,Prospect,Yeah.
16,SDR,"Okay, thank you for that. I will send you this information right after this call. Of course, I will describe the topics you want to include in that meeting. Just so I can know that everything is set up, please make sure to accept the invitation."
16,Prospect,Thank you.
16,SDR,Okay. Thank you for your time.
16,Prospect,Thank you.
17,SDR,Hey Justin
17,Prospect,"Hey, can I help you?"
17,SDR,"Yeah, I was just hoping for 30 seconds. This is Skylar with Nooks."
17,Prospect,"Sorry, with who?"
17,SDR,"Yeah, it's a company called Nooks."
17,Prospect,"Sorry, you're breaking up a little bit. I'm also in the basement of uh.. my home, so."
17,SDR,"Yeah, sorry about that. I think I've got bad wifi. So I asked.. I said I saw you were a sales manager. I was curious if you have reps that make cold calls or are they more focused on, like, inbound, like, warm leads and marketing stuff?"
17,Prospect,A bit of both.
17,SDR,"Okay, gotcha. When they make those cold calls, do they have, like, a specific tool they like to use, like LinkedIn, maybe something like that?"
17,Prospect,We're using Orum.
17,SDR,"Okay, gotcha. I'll tell you what Nooks does really quick. Then you can tell me if it's, like, relevant or if I'm just, like, out in left field here. Essentially, Nooks will pull in those call tasks, and it'll let them dial up to five lines at once. So instead of spending 30 seconds listening to that phone ring, it'll only connect them when they get a live prospect. So instead of spending all day for ten convos, they might be able to do that in an hour, and it'll free up some time for personalized outreach, like LinkedIn, email, account research, like, all that good stuff as well. Is that interesting, by any chance?"
17,Prospect,How do you guys compare with Orum.
17,SDR,You said Orum?
17,Prospect,Yeah.
17,SDR,"Yeah I used them for two years, so I think I can answer that pretty well. Biggest difference, number one, is pricing. We're about half the price. We also have the best engineering team I've ever seen, to be honest with you. I used Orum for two years, and they did not have a lot of updates until Nooks came along. And now they're trying to compete pretty heavily and release those updates to maintain that competitiveness. Yeah, we're always releasing new features. We've got the best sales floor right now in the dialer space, and we're priced pretty competitively. Would you be open to taking a look? It's probably easier to show you than just explain it over the phone."
17,Prospect,"I'm not certain whether we're really in a position this year to really invest in some of these tools. So I might suggest, I mean, in terms of timing, probably not this year at all."
17,SDR,"Okay. Two questions. Like, one, would you be open to taking a look just so it's on your radar so that when you do start thinking about those decisions, you know, you have a good idea of what Nooks is like?"
17,Prospect,"I mean, not really a priority for me right now because, I mean, if we're really going to be making an investment in a tool, like, I want to be able to have a budget for it, but I mean, we're, we're talking way too early."
17,SDR,"Sure. And I guess, have you ever had, like, this might be a really weird one-off case, but have you ever been in a situation like, I'm just assuming, but let's say pipeline generation is your priority and there's a tool that can help with that. Would there be a path forward if, like, leadership thought this was like a must to have or would that just still be, like dead on arrival?"
17,Prospect,"I mean, I think that's going to be, like, really difficult to.. It's going to be a challenge to push that up."
17,SDR,So you're saying there's a chance they'd continue with what they're using?
17,Prospect,"I mean, I think if you're going to be selling like any kind of revenue-generating tool, like kind of the answer around that is like, yes. Right. Like you can, you know, is it going to help generate revenue? Absolutely. I think part of this is just, you know, if we already have a pretty solid tool stack, like, what more can this thing actually do that we don't already have the capability of doing? Right? And next to that.. uh.. you know for an organization like us and yours. You want to have the sale? Totally get it. We want to get business done and generate some revenue. Something needs to give there and it boils down to budget."
17,SDR,"Yeah, I single dialed in for probably six months or so. And typically when teams switch from single dialing to using a dialer, they'll see a four to five times increase in productivity, which ultimately does result in a decent amount if your AEs are doing well. ARR on the back end there. So it is a big game changer for a lot of teams because right now those convos can be hard to come by."
17,Prospect,"Yeah, I mean, the only thing I can tell you that may be a challenge for us with.. I mean, we're using Orum and uh.. their dialer is just simply.. uh, what is it.. uh.. their local area dial.. I'm going to make a guess that you guys also have something that's a local area dial."
17,SDR,"So we let you pick up to five phone numbers, and if one gets marked as spam, we tell you you can switch it out. So, you know, I've got, with 4 or 5, it works pretty well for me. I've got like a ten to 12% connect rate with that. But some people, you know, two or six, I've heard, does really well. You can kind of play around with that to see what works best for your prospects and your team."
17,Prospect,And how does.. how does the number actually get.. uh..  I mean.. uh..  how do we actually know whether the number gets marked as spam or not?
17,SDR,"Yeah, so we go through Twilio and they report it to us. And from what I've seen, it seems pretty real time. I had a prospect once. He was one of those directors of sales that just doesn't like cold calls, I guess. And he got kind of angry and said, I'm going to report you to spam. And within two minutes, it was marked as spam in Nooks. And I deleted that phone number and changed it out."
17,Prospect,"Yeah. So, umm.. I mean, Orum is using Twilio as well.. umm. But it sounds like you guys have a way of taking a look to see the phone numbers that are used or purchased, which ones have been marked as spam. Is that something that end users can actually pick up on and see, or is that like an internal tool.. uh.. for your engineering team?"
17,SDR,"No. So you guys, we want you to be able to see that directly. We want you to have as much success as possible. So if you're calling with bad phone numbers, that's bad for us. We want you to get those connections and those pickups. I know you mentioned timing is kind of tough, but I could show you these things. We only have to do a full 30 minutes. We could do like 15 minutes. If that's something you're open to."
17,Prospect,"Let me do this.. uuhm.. I mean.. uuhm.. Shoot me an email. I happen to be like right in front of my inbox. You could probably see me open it. But uh..  if you don't mind, I'm going to share this internally with a couple of other BDR managers and just get their input on it. Even though we don't have budget. I mean, my.. my take on it is.. uuhm my take on it is. uh. I mean, in order for us to be able to roll something like this out, uuhm.. I mean, budget definitely needs to come from our execs. uhm.. That's going to be the major hang up and challenge for us, uuhm.. the other end of it is.. uhm.. just implementation because our.. uhm.. our team is pretty tight on just implementation. And so I don't know if this is going to be something like, you know, I'll give you an example of, like, Salesforce. Uuhm.. You can buy Salesforce, but Salesforce is not responsible for implementation or integrations. Right. We have to either do that ourselves or we have to hire third-party consultants to do that for us. So I don't know if that's going to be the same for your system."
17,SDR,"Yeah so Nooks is really smooth, actually, with integrations. So, number one, to prove out like a POC with leadership, we've got a two-week free trial with an ROI calculator. Our account executives are really hands-on with the trial. It's just a click of a button. Like, we just pull in those call tasks and then you've got them in Nooks. Usually it takes, we block off 30 minutes. Usually it takes five minutes to get that integration set up so we don't make you do that on your end."
17,Prospect,"uhm.. Two weeks? Do.. do you guys pilot for a longer period of time? And I'm going to make the assumption that if you guys do pilot, you guys want a contract in place."
17,SDR,"No. So it's a free trial, no contract in place. That two weeks is flexible. Like, if for some reason, let's say you've got bad data quality and you need to fix it, whatever reason it is, our founders usually work with people and they'll approve an extension if necessary. We've got one pretty big enterprise customer right now that's about to close, who's been in trial for probably two months or so because they had a really big team and it's taken some time to get them all onboarded. But, yeah, we make exceptions on a case by case basis."
17,Prospect,Okay. So where are you based?
17,SDR,So we're most of the team is in San Francisco. I'm in Denver. We have a guy who used to live in Toronto. He'll go back there occasionally. We've got some east coast people as well.
17,Prospect,Yeah. uhm.. How long have you guys been in business for?
17,SDR,"So we started in 2020, same time a lot of the dialers kind of took off. There's one that started in 2019. I think there's some that have been around a little longer, but that are more legacy and kind of outdated. Yeah, pretty much. Since 2020, though, we've been growing pretty quickly. Over 100 customers. We might be getting close to 2 million ARR."
17,Prospect,Yeah. Okay. Uuh.. If you don't mind. Shoot… uuh.. If you can shoot me an email. I'm just uh.. right in front of my inbox. And then.. uhm what's.. what's your role at the company?
17,SDR,So I'm a senior SDR. So lots of cold calling and list building. I kind of help build out those outbound processes and I do take some demo and disco calls now and then.
17,Prospect,Are you working off of any of those tools internally?
17,SDR,"Yeah, so I use LinkedIn."
17,Prospect,"Yeah. Okay. If you happen to be in Denver. Okay. I'm looking at my calendar right now. I'm willing to put in the time, just like my time personally in just taking a look at what the tool does.. uuh.. before I have this kind of put in front of all the other BDR managers. uhm.. What's your.. what's your timing like on this Friday at uh.. 8:30?"
17,SDR,Would that be eastern time?
17,Prospect,uhm.. Pacific standard time?
17,SDR,"So just one second, I'm just pulling up my calendar here. Yeah, I've got that open. That's perfect."
17,Prospect,"Yeah. Okay. If you want to shoot me uhm.. a calendar invitation for 30 minutes. uhm… 8:30. Actually, you know what, make it eight if that's okay."
17,SDR,"Yeah, that's perfect. That's fine."
17,Prospect,Okay.
17,SDR,And is your email the same.
17,Prospect,Yeah.
17,SDR,"Okay, awesome. So I'll get that calendar invite sent out. It might put it in spam just because Google's doing this thing first. Calendar invites, sometimes it's sending them to spam if you haven't communicated before, but otherwise it'll be in your inbox or your spam. And then I look forward to chatting with you on Friday at 8, Pacific."
17,Prospect,"Okay, that sounds great."
17,SDR,"Hey, thanks for taking my call man. I appreciate it."
17,Prospect,"Yeah, you're welcome."
18,SDR,"Hi, how are you? This is Andrea from Simera."
18,Prospect,"Oh, hi. Hi. How are you?"
18,SDR,"I'm good, thank you. I was wondering if you guys were in need of any remote workers. We have the candidates for that."
18,Prospect,What kind of remote workers?
18,SDR,"So basically we offer US companies and Canadian companies remote workers from Latin America. They speak full English and they're fully vetted and qualified for different types of roles. So we can even save up on payroll, and we handle all of the legal, like the legal part of it. So if you are ever interested, then I did send you an email."
18,Prospect,"Well, I'd like to know. Well, you guys give me some types of skill sets you're referring to. Give me some more details."
18,SDR,"It depends. So what we do is that, for example, if you tell me you need sales agents, for example, we look for the best sales agents for you guys. Depends on your job description. So we do match them. We have an AI verification."
18,Prospect,"How can you get like.. So for example, let me give you an example. I have some software, I'm in the insurtech business, life insurance, very specialized insurance technology for life insurance. Okay. And we have some software solutions that we resell to life insurance carriers. Right. And the idea is not to, is for those sales agents or whatever to actually get a meeting scheduled. But if you don't know the business or you don't have a relationship, it's going to be very difficult to do those kind of sales calls. So I'm not sure if, I'm just trying to figure out how are you going to help me? You see, you understand what I'm trying.."
18,SDR,"So I understand what you mean. However, I believe that if you hire anyone, like at all for that position, you will kind of have to give some training to them on the industry, the specific industry that you're in."
18,Prospect,"Oh, I have no problem with.. No problem with the training that's yet. Training. No problem. My question is, is that I don't know if they can, you know, the kind of people or senior people they need to contact. How are they going to be able to, if they don't, if these people don't have a relationship or they're not well known, how are they going to be able to get those people to interact with them so they can give them the sales pitch and then schedule a demo. Right? That would be the objective. And then after they schedule the demo, they finish. That's all the job is. Right? Yeah, but the problem is that.. But they have to be able to.. So it's very difficult, unless that's what I'm saying. So without the relationship or the contacts that would be able to do that. Yeah."
18,SDR,"Okay. I understand. So just how we do it here in Simera. I work in sales, as you can see. We do the research, we do the process."
18,Prospect,You want to spell for me?
18,SDR,"Yeah. Correct. This is a sales call, basically. So basically we do all the prospecting, the right research and stuff for the people that potentially be interested."
18,Prospect,"Yeah, this is a little bit more than prospecting. It's more about.. It's a little bit of qualifying. I mean, enough to make sure that they're.. Get them excited to want to see because the value is so big, or we know that they're actively looking for a particular type of software solution and to get the right person. And then they need to be able to, when we say prospecting, they have to be able to reach out to some key people. I don't know. I mean, maybe you guys are very effective in that. I don't know, but.. And then what do you charge for that? I mean, how does that work?"
18,SDR,"Well, we do have a Simera fee, but we can present to you the candidates before you don't. You don't have to pay for anything until you decide to hire someone. We do have different types of fees."
18,Prospect,"If we hire someone, what does that cost? How does that work?"
18,SDR,"I believe the fee for Simera is $2500. I believe it depends on the candidate and it depends on how many you got. But let me tell you something. I work in sales, so I'm not the right person like to talk to about this. So how about I set you up with my co-founder for ten minutes and he can explain to you every single thing."
18,Prospect,Let me see your website. How do you spell the name of your website?
18,SDR,S-I-M-E-R-A
18,Prospect,Dot com?
18,SDR,"Simera dot I-O, I-O."
18,Prospect,"I-O, Okay. It didn't work. F-I-N-E-R-E? Maybe I did it wrong."
