convoid,person,dialogue
1,Prospect,Doug Markham.
1,SDR,"Morning, Doug. How are you?"
1,Prospect,I'm fine. How are you?
1,SDR,"Good. Good. Doing good, Doug. So, Doug, Josh again from Contango. I did speak to you, I guess not last week. Last week, you were really traveling at that time. I caught you on a Friday, and you were really busy, so you asked me to call back after some time. So, Doug, again, like calling from Contango, I did send you that email once again, and you said you'd check it over the weekend. I don't know if you've checked that or not, but we are a full-service IT provider. The reason I was calling today is I just wanted to quickly set up a 15-20 minute call with one of my senior account guys. We can tell you more about what Contango IT is, what we do, and how we do it. I really think, because we have been working with similar companies like yours, that we can add value to your business. It's not something I want to sell to you right at the moment; it's more about understanding your business a little bit more and you understanding our products and services. I just need 20 minutes of your time to explain a little bit more about Contango."
1,Prospect,"What is your specialty? I mean, walk me through your developers, your IT resource. What's your suite?"
1,SDR,"Well, if I talk about the services and products, Doug, we are a 100-person company with four different departments, covering everything from networks to outsourced CIO to help desk to application programming, infrastructure, everything A to Z in IT services. Honestly, getting into the tech details of these products and services, I would love to answer all your questions, but I'm not the correct person to do that. That's why I wanted someone senior from my team to tell you what we can do for you and how we can add value to your business. We're not the kind of company that just picks up the phone and sells something right away."
1,Prospect,"Well, this week, I mean, probably the best thing to do is get a debrief and then.."
1,SDR,"Yeah, yeah. We can possibly give you the first introduction, and if required, we can pull in anyone else from your company to go into a more detailed discussion. Generally, what we do is have the first discovery call, and then we can give you something like a need assessment. That's what we call it, and then we can go from there. So this first call is just a discovery call."
1,Prospect,"Friday, I'm kind of open from 11:30 till 1:30 Central Time. See if a little 15-minute window fits in there."
1,SDR,"Yeah, 11:30."
1,Prospect,You said 11:30 to 1:30 Central. I am open this Friday the 17th.
1,SDR,"Friday the 17th, right? Yep, yep. That's no problem. I can speak to one of the best people from my team, the senior guys, and try to get them on the call. I'll try to get the best one. And last time I checked, you were about 40 people in the office, or has that increased, decreased in any way?"
1,Prospect,That's accurate.
1,SDR,That's accurate. And how do you currently manage your IT? Is it something that you do a little bit in-house and a little bit outsourced?
1,Prospect,"Our VP of engineering does it all. That's what I'm saying, he drives it."
1,SDR,"I get that. And you are headquartered in Canada with another four locations, one in Nashville, Tennessee, and others in Tennessee and Miami."
1,Prospect,We're North America.
1,SDR,"Yep, yep, yep. Cool. No problem, Doug. And your email is Doug at wise docs AI?"
1,Prospect,"Right, just send me an invite if a 15-minute window fits on the 17th between those hours."
1,SDR,"Yeah, definitely. I will do that. No problem."
1,Prospect,And then I'll push you over to our VP of engineering to dig a little deeper.
1,SDR,"Yeah, sure. We can definitely do that. Okay. All right, sounds good. Thanks. You have a nice day. Bye bye."
1,Prospect,You too. Take care.
2,SDR,"Hi, good afternoon. Am I speaking to Justin?"
2,Prospect,Yes.
2,SDR,"Hi, Justin. Josh from Contango. How are you?"
2,Prospect,"Good, how are you?"
2,SDR,"Doing great, great. Doing good, Justin. Thanks for asking. So, Justin, just a quick one. I had actually sent you an email a few days back, so I was just trying to reach out to you to see if you've got the email. And did you get a chance to look at that?"
2,Prospect,Okay. I'm still catching up on emails. Who did it come from?
2,SDR,That's Contango.
2,Prospect,Contango. How do you spell that?
2,SDR,That's C-O-N-T-A-N-G-O.
2,Prospect,And you said it was a few days ago?
2,SDR,"Yeah, a few days ago."
2,Prospect,You said C-A-N-G-O?
2,SDR,C-O-N-T-A-N-G-O.
2,Prospect,I'm not getting anything. Come up. C-O-N-T-A-N-G-O.
2,SDR,Yep.
2,Prospect,Okay. Nothing's coming up.
2,SDR,"No, never mind. Never mind. I can resend you the email."
2,Prospect,"Okay, what's it regarding?"
2,SDR,"Yeah, that's where I was coming to. So, as I'm calling from Contango, Justin, we are a full-service IT company, and we have been working with firms like yours. They are really happy customers. The reason for my call today is I just wanted to have a quick 20 minutes sometime next week where I can possibly get one of my senior account guys on the call and explain more about what Contango IT is, what we do, and how we do it. I'd be very confident in saying we can definitely add value to your business because we have been working with similar customers like yours. So I was just looking to see if we can have 20 minutes of your time sometime next week."
2,Prospect,"Okay, let's see here."
2,SDR,"Probably, like, next Thursday, the 16th."
2,Prospect,Okay. And you said you're an IT company?
2,SDR,"IT company. Right. I will definitely send that email once again, and you can go through all the website and things like that."
2,Prospect,"Okay. All right, let's start off with that, and I'll let you know what we're thinking."
2,SDR,"Okay, so let me send you this calendar invite for next Thursday, the 16th, with all the information, probably around 3:00 PM after lunchtime when you're not really super busy, and then we can go from there."
2,Prospect,"Okay, sounds good."
3,Prospect,Hey.
3,SDR,"Hi, mister. This is Amir with Growfin AI. I've called you completely out of the blue here today. We've never spoken before. Is this a good time to speak very briefly, or have I called you at the worst minute today?"
3,Prospect,"Very briefly. Very briefly. Sorry, I didn't catch your name."
3,SDR,My name is Amir and I'm with Growfin AI. Growfin. Does that name ring a bell at all?
3,Prospect,Grillfin? No.
3,SDR,"Okay, so I'm gonna be really brief, mister. I have been on your LinkedIn. I have seen you've got tremendous endorsements in terms of account receivables. I see your experience. I had a couple of quick questions. One thing I hear a lot from collection managers is that it's a top priority to keep past due payments less compared to outstanding receivables. How do you go about doing that today, Mister Silver?"
3,Prospect,"Well, obviously we have a team, but.. So, Amir, are you selling something? Do you have a service? What is this in regards to?"
3,SDR,"Service, obviously this is a cold call. I want to gain insights. But to be really transparent, we have built an AR automation solution which is purpose-built for account receivables. It integrates with your system, pulls in data, pulls out data, and it sort of streamlines the entire end-to-end AR process, including cash applications, reconciliations, and so forth. Given your experience, I was wondering if you'd be inclined towards perhaps, maybe exploring—not purchasing—not talking about, hey, we want to purchase this, nothing like that. Just exploring what we offer and see if there's some sort of technical fitment. And perhaps, in the worst case scenario, we'll just part ways as friends."
3,Prospect,"So the only thing I can suggest at this point, Amir, is to send us any information, literature, documents, anything that you can, and we will have to take a look at it from our end. Right now, you know, it's the end of the year, end of the quarter coming up. It's a very busy time. I won't be able to look at anything until the new year. But if you want to send us something, by all means, send us what you have and we will eventually take a look at it."
3,SDR,"Absolutely. Is there anything specific, based on challenges, based on what you foresee coming up in the upcoming quarters, any challenges in particular? Anything in particular you're looking for in this email?"
3,Prospect,"No. Just to see what you guys offer. I mean, there's a lot of businesses and a lot of software out there that do the exact same thing. And we're always open to something if it's worth it for us. So if you want to send me something, we'll definitely take a look at it."
3,SDR,"Absolutely. Will do. To give you some context, just so my email stands out from others—I believe you get a whole bunch of these emails and calls—we are a collaboration-first solution. What we recognize is there's a silo between the sales team and the finance teams. Finance cannot collaborate with sales except for over emails like Slack or phone calls or whatnot. So the AR solution that I'm talking about, Growfin, is a collaboration-first AR solution. It sort of gives you that front to collaborate with your sales teams as well. I know it's the end of the month, it's also the end of the year. Next year, in the first week of January, you'll probably be tied up with closing as well. I promise I won't take much of your time—perhaps maybe in the second week of January. 15 minutes is all I ask, 15 minutes."
3,Prospect,"I'll be honest with you, I won't be available in December. If anything happens, it will have to be in the new year."
3,SDR,"Understood. Got it. New year it is then. So I'm going to send you an email. Is it okay if I place a placeholder on your calendar for the second week of January? The reason I'm saying this is because I don't want to make it sound like a cold call again when I reach out to you in January. I'll follow up with you multiple times over email. I'll send you some beautiful stuff, literature about what we do, keep you engaged. And come January, we could absolutely just set up 15 to 20 minutes. We give you a brief, see if there's technical fitment, and then if you're interested, we could perhaps keep the conversation going. Sounds good?"
3,Prospect,"That's fine. And it's Grillfin, G-R-I-L..?"
3,SDR,"If you're in front of your system, I would encourage you to go to Growfin dot AI."
3,Prospect,"Growfin dot AI? Yep. Okay. All right, send me what you have and we'll take a look at it."
3,SDR,"Can I also set a placeholder on your calendar? If you permit me, for January 10th, which is the second week. It's a Wednesday, perhaps maybe 11:00 AM. I'm not sure."
3,Prospect,How about the third week? Do the third week of January.
3,SDR,Third week of January. Wednesday works fine? Or are Fridays better for you?
3,Prospect,Probably Wednesdays.
3,SDR,Wednesday. And what time zone are you in?
3,Prospect,Eastern time zone.
3,SDR,"Eastern time zone. Would 11:00 AM be too early, or do you prefer post-lunch, around 2:00 PM or so?"
3,Prospect,"No, 11:00 is fine."
3,SDR,"11:00 is fine. Beautiful. I'm going to keep in touch with you, Mister. You've been really, really kind. You've given me tremendous time. I appreciate it. Looking forward to speaking with you a month and a half down the line."
3,Prospect,All right. Very good.
3,SDR,Thank you. Thank you so much. All the very best. Bye bye.
3,Prospect,"Thank you. All right, bye."
4,Prospect,Hello
4,SDR,Nancy?
4,Prospect,Yeah
4,SDR,"Nancy, it is Andrea Kleiman and I am an absolute stranger, so don't rack your brain trying to figure it out. I don't know you. You don't know me. A complete stranger here. Are you able to talk for a brief moment?"
4,Prospect,I have about a minute.
4,SDR,"Oh, beautiful. That's all I need. Okay, wonderful. Look, I was online and I was doing some research for another realtor in Tucson, and I actually came across your name. So I wanted to find out, are you still doing real estate? Are you doing it as a hobby or are you doing it as a career?"
4,Prospect,I'm doing it full time.
4,SDR,"Okay. You're doing it full time? Okay, wonderful. I know that you said I had a minute, so I don't want to be disrespectful, but I do marketing for realtors. I help you guys with web, social, and more. My quick question was, do you have any personal interest in improving your web presence for the future? Because I know it's a really, really, really hot market out there. You guys are doing very well and I just wanted to see if I can get some time with you another day and let you interview me. You're the boss. I'm just applying for the job—just interview me and see what I have to offer. But I really feel like there's an asset in me helping you."
4,Prospect,"First of all, I like your style. It's nice because I haven't hung up on you yet. So awesome. Second of all, I have a really good friend who is doing the same thing, who is trying to get me to do the same thing. And so I've just started working with her. We've just started a business Facebook page, doing a few things. And so honestly, I know I need some help, but I'll be working with her, though."
4,SDR,"This is heartbreaking. I'm actually crying right now. Nancy, you know, unfortunately, I was taught a long time ago that I gotta get at least 20 no's. We're only on no one right now."
4,Prospect,Okay.
4,SDR,"Look, look, here's the deal. I'm a good team player, right? I used to play football for years. I grew up here in San Diego. Most of my friends played professional football. My good friend Leroy Glover is actually getting inducted into the Hall of Fame. You probably know a lot of my friends. You know Marshall Faulk?"
4,Prospect,"No, I don't."
4,SDR,"Okay, you're not a football buff. Okay, fine. Whatever. Bottom line is, I'm all about teamwork. If you have someone that is going to participate in helping you grow your life and your business, first of all, congratulations, because realtors work so hard. And I know that you guys put a lot of time and energy into just learning new tools and new technology. So cheers to you for even taking a leap of faith in paying her to do that. How much are you paying her? Is this like $1,500 a month? Is this $2,000? How much do you gotta pay to make her do all this stuff for you?"
4,Prospect,"Well, in addition to her, I also have a coach, so I am well ingrained in that. I need help."
4,SDR,"Okay, rewind. How much are you paying this coach? Because I know what coaches charge. I travel quite a bit around the country. The last coach I met was charging $6,000."
4,Prospect,My coach isn't quite that expensive. But you know what? My time is truly up. I have a client walking in.
4,SDR,Okay.
4,Prospect,"And I've got to go. But I like your style. I think you're going to do fine. And here's your no, I'm sorry."
5,SDR,"Hey, this is Colin with Ledium here. I'm actually giving you a call for the first time. Do you have like half a minute? I can tell you exactly why I decided to cold call you today."
5,Prospect,Sure. Yeah.
5,SDR,"So the reason I'm reaching out is really just to introduce my company to you, Ledium. When I'm not calling you out of the blue, are you available like, say, Tuesday or Thursday around 09:00 your time next week?"
5,Prospect,For what?
5,SDR,"Yeah, I definitely want to make sure it's relevant. Again, I'm calling from Ledium. It's a bit of a small industry with what we do, but have you ever heard of us before?"
5,Prospect,"No, I haven't. Yeah."
5,SDR,"So we work with growth stage companies, helping them to supplement their sales development efforts."
5,Prospect,Really?
5,SDR,Just wanted to ask you a question. Have you ever evaluated the performance of your in-house team versus an outsourced sales development team?
5,Prospect,"I'm doing that currently now, yeah."
5,SDR,Awesome! And how have things been going?
5,Prospect,I don't know. I'm going to be running a pilot with an outside sales team.
5,SDR,Got it. Okay. When is that supposed to be getting kicked off?
5,Prospect,As soon as we make a decision. Probably in the next two weeks.
5,SDR,"Yeah. I mean, I know sometimes, you know, I'm not always so lucky for the timing to be as perfect as this, but what are the chances I could throw my hat in the ring to put us in there as an option? You know, would it be a terrible idea to get like 15 minutes?"
5,Prospect,"So tell me, tell me your spiel. Yeah. Help me understand what technologies you use. Yeah. Tell me what—let me give you a—I'll give you a real quick, high-level thing. Sure. I've already engaged with four different companies or competitors of yours. Yeah. So I'm reluctant to use you. Yeah. But here's your shot. Yeah. We're a major Microsoft partner. Yep. A lot of what we do is work with the Microsoft Teams and their VPs and their ten to twenty sales reps. And what I'm going to do is I'm going to develop a pilot around one of those VPs, probably in the Midwest around manufacturing as a vertical. So what I want to understand is how you would run this pilot. Yes. There's ten sales reps that we support. That's probably 1,000 to 5,000 enterprise customers. And I'll probably run this around the Power Platform. So it's going to be director level and above that I'm going to be having you guys reach out to. Yes."
5,SDR,"So, I mean, look, I know I'm calling you out of the blue. I'm more than willing to take my shot here, but without getting too deep in the weeds and getting too pitchy or salesy here on this call. You know, we're a small boutique firm. We only manage about 30 clients at a time. Our founders have been in business for over ten years. Funny story is, I actually used to be a customer of Ledium before I actually started working with them now as a partner. And they helped me scale a unified communications platform all the way to exit. So that's me taking my shot really quick in a short amount of time without taking up too much of your time. But why don't we do this? Just give me 15-20 minutes on the calendar, either Thursday or Friday, then we can get into a little bit more detail, a strategy of how I'd run the POC for you."
5,Prospect,"You're really late to the table on this. I don't have the time. So I'm looking for your pitch now. If you can't do it, that's fine, but I'm looking for your pitch now."
5,SDR,"Sure I could, but it would just be shooting off the hip a bit. Like I know a little bit about what you do. I didn't expect you to be actively buying for this right now. Doesn't always work out that way. If you want to give me 20 minutes, I can tell you it'd be worth it. And at the end of that 20 minutes, if you feel like it's not a good fit, we can part friends. I think that in 20 minutes you could hear enough to at least pop us up to your first or second choice before making a decision. What's the worst that could happen? Would Thursday or Friday work better for you?"
5,Prospect,Friday at 11:30 to 12:00 Eastern.
5,SDR,"All right, you got it. What's the best email for you? So it was first name, last name, and then what was the last part there? All right, I'll send that over for 11:30 your time on Friday, and I'll send you over a bit of information so you have a little more context going into that call. Fair enough?"
5,Prospect,"Okay, thanks."
5,SDR,"All right, thanks for your time."
5,Prospect,Appreciate it.
6,Prospect,Hello.
6,SDR,"Hey, this is Heidi. How's your Friday going?"
6,Prospect,"Pretty good, how are you doing?"
6,SDR,"Well, thanks. Not sure if you had a moment, but I had a few questions. Is this a good time?"
6,Prospect,Sure.
6,SDR,"Okay, cool. I see that you head up insights and analytics, and I'm definitely a big fan of using it a lot. Unfortunately, maybe unfortunately, but I know you guys have an online chat with wine experts, that type of thing. Do you look at analytics for those conversations at all or not really?"
6,Prospect,"A little bit, I'd say. We're sort of in the process of getting those learnings. We use Zendesk, so we're kind of downloading that data out of Zendesk and combining it with our internal data. So that's sort of an ongoing process, I'd say."
6,SDR,"Totally. Well, we actually created something to help you out with that and have like a dashboard in one place. We're kind of trying to get some feedback from people in the US. It's pretty popular in Europe already. So I was wondering if that's something you might want to check out. No pressure situation, but just see how it works for the future."
6,Prospect,Sure.
6,SDR,Okay. Would you have time to chat like Monday or Tuesday?
6,Prospect,Mondays are pretty busy for me.
6,SDR,"Oh, yeah, Tuesdays would be better maybe."
6,Prospect,"Yeah, Tuesday would be better. Tuesday morning."
6,SDR,"Let me see, you guys are based in.."
6,Prospect,Yeah. Cool.
6,SDR,"So actually Michael, that could meet with you. He's really awesome. Let me see, Tuesday afternoon."
6,Prospect,I could do Tuesday at 03:00 p.m. Pacific.
6,SDR,"Okay, sweet. Tuesday at three. Cool. So I'll send you an invite for a meeting with Michael. Let me just make sure I got a good email for you. I have.. Okay. I have.. Does that work?"
6,Prospect,Yep.
6,SDR,"Okay, sweet. All right, cool. So hopefully I put your email in there correctly. If I didn't, that's my bad. I'll just let Michael know and you'll be meeting with him, and he'll just go over what our analytics looks like and how it would work with what you already have. And yeah, we can get some feedback from you and see what you think."
6,Prospect,Sounds good.
6,SDR,"Okay, cool. Is there anything that you'd like me to tell him that you want to see specifically? Like, are there certain numbers and metrics that you're looking for so that we can make the most out of your time?"
6,Prospect,"I would say what we're probably most interested in is thinking about the lifetime value of customers who interact with the chat versus those who don't. Like, you know, our chat is—we have customer service, but then we also have a recommendations chat. So there are people who are wine experts that are there to help you non-commission. So it's really.. Obviously, you know, we want them to help people find wine, but not like a salesperson. So just understanding, you know, that interaction."
6,SDR,"Yeah, absolutely. Okay, cool. Well, we have a few cool things with that too. If you ever don't have somebody that's available, we actually have product experts that can jump in to give you full coverage. So I can make sure Michael tells you about how that would work, what metrics you'd be looking at, and what the suite looks like. Okay, awesome. Anybody else that would maybe want to be on the call that would feel left out or..?"
6,Prospect,"No, I think it's fine to do just me for now."
6,SDR,"Okay, well, appreciate your time, hope you have a really great weekend, and I'll let Michael know what you were looking to see, and we look forward to speaking with you."
6,Prospect,"Cool. All right, thanks."
7,Prospect,Bryan speaking.
7,SDR,"Oh, is this you?"
7,Prospect,Yeah. Who's this?
7,SDR,"Oh, dude, this is sick. This is Jacob. I'm cold calling you, but I figured being in sales, you'd be open to it."
7,Prospect,Yeah. Where are you calling from?
7,SDR,"Calling from Service Bell. And the reason I'm calling you specifically is I saw your post on, or your comment on a post about, well, the top ten things that he learned in his early sales role. You specifically mentioned you cared about speed to lead."
7,Prospect,Yeah.
7,SDR,I have the best speed to lead solution on the market. That's why I'm calling you.
7,Prospect,"Okay. Sounds good! Yeah, so what do you guys.. what do you guys do?"
7,SDR,"So I can notify you when a prospect is on your website, like in real time, on an important page. And then you can call them on the website, like video call them instantly on the website and catch them at the perfect time instead of having to email, follow up later, chase them down, etcetera."
7,Prospect,"Interesting, and do they have to prompt that? Like, do you do that through, like, an intercom thing or something?"
7,SDR,"You do not have to. It's kind of like intercom but with video. And it.. It's easier if you see it. In fact, if you go to servicebell.com, I can just call you and show you right now. It might be easier."
7,Prospect,Sure. Yeah. Or even.. Yeah. Do you mind? I'm just.. I'm actually just at lunch right now. Do you mind even just shooting me an email with that link? I'll take a look at it. And let's call maybe on a Friday or something.
7,SDR,"That works for me. I have a post I did on LinkedIn that shows how this works. That got a lot of attention. So I'll tag you in it, if that's cool. And then Friday.. Are you.. You're in Vancouver. Oh, is that.. Is it 01:00 for you? 1:15?"
7,Prospect,"Yes, it is."
7,SDR,"Okay, great. You mentioned Friday morning or afternoon?"
7,Prospect,uhm.. Let's do morning.
7,SDR,Okay. How about 10:00 a.m. your time?
7,Prospect,"Yeah. I'm gonna just look here quickly. Yep, that works."
7,SDR,"Okay, great. And your email?"
7,Prospect,Give me a shot then. It's just my first name.
7,SDR,"Okay, cool. One last question for you is.. So the post I'm going to tag you in is a live cold call where basically I make outbound sales content on LinkedIn and YouTube to kind of teach people how to cold call and also help me generate leads. Do you mind if I use this as part of the content?"
7,Prospect,"Yeah, sure. That's fine."
7,SDR,"Dude, thank you, you're the man. I'll see you Friday and I'll shoot you.. Actually, a LinkedIn DM comment tag."
7,Prospect,Sounds good.
7,SDR,See you.
7,Prospect,"Yeah, sounds good. Thanks."
8,Prospect,Yes.
8,SDR,"Hey, what's going on? It's Landon over here at Anomalo. I know I'm kind of catching you out of the blue here, but I was hoping to tell you why I was giving you a ring."
8,Prospect,"Yeah, but I'm out of the office right now, so you can call me next week. That would be great."
